{
  "schema_version": 1,
  "transition_id": "77777777-7777-4777-8777-777777777777",
  "incident_id": "66666666-6666-4666-8666-666666666666",
  "sequence": 2,
  "from_state": "verifying",
  "to_state": "escalating",
  "trigger": "check_in_help",
  "occurred_at": "2026-07-18T14:32:16Z",
  "source_event_id": null,
  "check_in_id": "88888888-8888-4888-8888-888888888888",
  "simulated": false
}
